<?xml version="1.0" encoding="utf-8" ?> 
<map xmlns="urn:hl7-org:knowledgeartifact:r1:engine" xmlns:xsi="http://www.w3.org/2001/XMLSchema-instance" xsi:schemaLocation="urn:hl7-org:knowledgeartifact:r1:engine ..\..\HeDEngine\Maps\HandlerMap.xsd" handlerType="ModelTranslation">
	<!-- Model transformation classes for SQL Artifacts -->
	<entry key="EvaluatedPerson" value="SQL.Translation.PatientTranslator,SQL.Translation"/>
    <entry key="AD" value="SQL.Translation.AddressTranslator,SQL.Translation"/>
	<entry key="ADXP" value="SQL.Translation.AddressPartTranslator,SQL.Translation"/>
	<entry key="AdverseEvent" value="SQL.Translation.AllergyTranslator,SQL.Translation"/>
	<entry key="DeniedAdverseEvent" value="SQL.Translation.AllergyTranslator,SQL.Translation"/>
	<entry key="EncounterEvent" value="SQL.Translation.EncounterTranslator,SQL.Translation"/>
	<entry key="ObservationOrder" value="SQL.Translation.ResultTranslator,SQL.Translation"/>
	<entry key="ObservationProposal" value="SQL.Translation.ResultTranslator,SQL.Translation"/>
	<entry key="ObservationResult" value="SQL.Translation.ResultTranslator,SQL.Translation"/>
	<entry key="UnconductedObservation" value="SQL.Translation.ResultTranslator,SQL.Translation"/>
	<entry key="Problem" value="SQL.Translation.ProblemTranslator,SQL.Translation"/>
	<entry key="DeniedProblem" value="SQL.Translation.ProblemTranslator,SQL.Translation"/>
	<entry key="ProcedureEvent" value="SQL.Translation.ProcedureTranslator,SQL.Translation"/>
	<entry key="ProcedureOrder" value="SQL.Translation.ProcedureTranslator,SQL.Translation"/>
	<entry key="ProcedureProposal" value="SQL.Translation.ProcedureTranslator,SQL.Translation"/>
	<entry key="SubstanceAdministrationEvent" value="SQL.Translation.MedicationTranslator,SQL.Translation"/>
	<entry key="SubstanceAdministrationOrder" value="SQL.Translation.MedicationTranslator,SQL.Translation"/>
	<entry key="SubstanceAdministrationProposal" value="SQL.Translation.MedicationTranslator,SQL.Translation"/>
	<entry key="UndeliveredSubstanceAdministration" value="SQL.Translation.MedicationTranslator,SQL.Translation"/>
    <entry key="RelatedClinicalStatement" value="SQL.Translation.RelatedClinicalStatementTranslator,SQL.Translation"/>
</map>
