<?xml version="1.0" encoding="utf-8" ?> 
<map xmlns="urn:hl7-org:knowledgeartifact:r1:engine" xmlns:xsi="http://www.w3.org/2001/XMLSchema-instance" xsi:schemaLocation="urn:hl7-org:knowledgeartifact:r1:engine ..\..\HeDEngine\Maps\HandlerMap.xsd" handlerType="NodeTranslation">
	<!-- Artifact translator for CREF Artifacts -->
	<entry key="urn:hl7-org:knowledgeartifact:r1:ExpressionRef" value="CREF.Translation.ExpressionRefTranslator,CREF.Translation"/>
	<entry key="urn:hl7-org:knowledgeartifact:r1:ParameterRef" value="CREF.Translation.ParameterRefTranslator,CREF.Translation"/>
	<entry key="urn:hl7-org:knowledgeartifact:r1:Literal" value="CREF.Translation.LiteralTranslator,CREF.Translation"/>
	<entry key="urn:hl7-org:knowledgeartifact:r1:Interval" value="CREF.Translation.IntervalTranslator,CREF.Translation"/>
	<entry key="urn:hl7-org:knowledgeartifact:r1:List" value="CREF.Translation.ListTranslator,CREF.Translation"/>
	<entry key="urn:hl7-org:knowledgeartifact:r1:And" value="CREF.Translation.AndTranslator,CREF.Translation"/>
	<entry key="urn:hl7-org:knowledgeartifact:r1:Or" value="CREF.Translation.OrTranslator,CREF.Translation"/>
	<entry key="urn:hl7-org:knowledgeartifact:r1:Not" value="CREF.Translation.NotTranslator,CREF.Translation"/>
	<entry key="urn:hl7-org:knowledgeartifact:r1:Case" value="CREF.Translation.CaseTranslator,CREF.Translation"/>
	<entry key="urn:hl7-org:knowledgeartifact:r1:Conditional" value="CREF.Translation.ConditionalTranslator,CREF.Translation"/>
	<entry key="urn:hl7-org:knowledgeartifact:r1:Null" value="CREF.Translation.NullTranslator,CREF.Translation"/>
	<entry key="urn:hl7-org:knowledgeartifact:r1:IfNull" value="CREF.Translation.IfNullTranslator,CREF.Translation"/>
	<entry key="urn:hl7-org:knowledgeartifact:r1:Coalesce" value="CREF.Translation.CoalesceTranslator,CREF.Translation"/>
	<entry key="urn:hl7-org:knowledgeartifact:r1:As" value="CREF.Translation.AsTranslator,CREF.Translation"/>
	<entry key="urn:hl7-org:knowledgeartifact:r1:Equal" value="CREF.Translation.EqualTranslator,CREF.Translation"/>
	<entry key="urn:hl7-org:knowledgeartifact:r1:NotEqual" value="CREF.Translation.NotEqualTranslator,CREF.Translation"/>
	<entry key="urn:hl7-org:knowledgeartifact:r1:Less" value="CREF.Translation.LessTranslator,CREF.Translation"/>
	<entry key="urn:hl7-org:knowledgeartifact:r1:LessOrEqual" value="CREF.Translation.LessOrEqualTranslator,CREF.Translation"/>
	<entry key="urn:hl7-org:knowledgeartifact:r1:Greater" value="CREF.Translation.GreaterTranslator,CREF.Translation"/>
	<entry key="urn:hl7-org:knowledgeartifact:r1:GreaterOrEqual" value="CREF.Translation.GreaterOrEqualTranslator,CREF.Translation"/>
	<entry key="urn:hl7-org:knowledgeartifact:r1:Add" value="CREF.Translation.AddTranslator,CREF.Translation"/>
	<entry key="urn:hl7-org:knowledgeartifact:r1:Divide" value="CREF.Translation.LessTranslator,CREF.Translation"/>
	<entry key="urn:hl7-org:knowledgeartifact:r1:TruncatedDivide" value="CREF.Translation.TruncatedDivideTranslator,CREF.Translation"/>
	<entry key="urn:hl7-org:knowledgeartifact:r1:Modulo" value="CREF.Translation.LessTranslator,CREF.Translation"/>
	<entry key="urn:hl7-org:knowledgeartifact:r1:Ceiling" value="CREF.Translation.LessTranslator,CREF.Translation"/>
	<entry key="urn:hl7-org:knowledgeartifact:r1:Floor" value="CREF.Translation.LessTranslator,CREF.Translation"/>
	<entry key="urn:hl7-org:knowledgeartifact:r1:Negate" value="CREF.Translation.NegateTranslator,CREF.Translation"/>
	<entry key="urn:hl7-org:knowledgeartifact:r1:Round" value="CREF.Translation.RoundTranslator,CREF.Translation"/>
	<entry key="urn:hl7-org:knowledgeartifact:r1:Power" value="CREF.Translation.PowerTranslator,CREF.Translation"/>
	<entry key="urn:hl7-org:knowledgeartifact:r1:First" value="CREF.Translation.FirstTranslator,CREF.Translation"/>
	<entry key="urn:hl7-org:knowledgeartifact:r1:Last" value="CREF.Translation.LastTranslator,CREF.Translation"/>
	<entry key="urn:hl7-org:knowledgeartifact:r1:DateAdd" value="CREF.Translation.DateAddTranslator,CREF.Translation"/>
	<entry key="urn:hl7-org:knowledgeartifact:r1:Today" value="CREF.Translation.TodayTranslator,CREF.Translation"/>
	<entry key="urn:hl7-org:knowledgeartifact:r1:Contains" value="CREF.Translation.ContainsTranslator,CREF.Translation"/>
	<entry key="urn:hl7-org:knowledgeartifact:r1:IsEmpty" value="CREF.Translation.IsEmptyTranslator,CREF.Translation"/>
	<entry key="urn:hl7-org:knowledgeartifact:r1:IsNotEmpty" value="CREF.Translation.IsNotEmptyTranslator,CREF.Translation"/>
	<entry key="urn:hl7-org:knowledgeartifact:r1:Filter" value="CREF.Translation.FilterTranslator,CREF.Translation"/>
	<entry key="urn:hl7-org:knowledgeartifact:r1:In" value="CREF.Translation.InTranslator,CREF.Translation"/>
	<entry key="urn:hl7-org:knowledgeartifact:r1:Property" value="CREF.Translation.PropertyTranslator,CREF.Translation"/>
	<entry key="urn:hl7-org:knowledgeartifact:r1:BooleanLiteral" value="CREF.Translation.BooleanLiteralTranslator,CREF.Translation"/>
	<entry key="urn:hl7-org:knowledgeartifact:r1:CodeLiteral" value="CREF.Translation.CodeLiteralTranslator,CREF.Translation"/>
	<entry key="urn:hl7-org:knowledgeartifact:r1:PhysicalQuantityLiteral" value="CREF.Translation.PhysicalQuantityLiteralTranslator,CREF.Translation"/>
	<entry key="urn:hl7-org:knowledgeartifact:r1:StringLiteral" value="CREF.Translation.StringLiteralTranslator,CREF.Translation"/>
	<entry key="urn:hl7-org:knowledgeartifact:r1:ClinicalRequest" value="CREF.Translation.ClinicalRequestTranslator,CREF.Translation"/>
	<entry key="urn:hl7-org:knowledgeartifact:r1:ValueSet" value="CREF.Translation.ValueSetTranslator,CREF.Translation"/>
	<entry key="urn:hl7-org:knowledgeartifact:r1:InValueSet" value="CREF.Translation.InValueSetTranslator,CREF.Translation"/>
</map>
